{
  "$schema": "https://json-schema.org/draft/2020-12/schema",
  "$id": "https://pfem.local/schemas/retention_permanent_archive_terminal_closure_final_integrity_seal_closeout_record.schema.json",
  "title": "PFEM Retention Permanent Archive Terminal Closure Final Integrity Seal Closeout Records",
  "type": "object",
  "required": [
    "retention_permanent_archive_terminal_closure_final_integrity_seal_closeout_record_id",
    "closeout_kind",
    "created_time",
    "node_id",
    "retention_permanent_archive_terminal_closure_final_integrity_seal_verification_receipt_id",
    "retention_permanent_archive_terminal_closure_final_integrity_seal_record_id",
    "closeout_state",
    "outcome",
    "closed_refs",
    "subject_refs",
    "basis_refs",
    "closed_by_ref",
    "summary"
  ],
  "properties": {
    "retention_permanent_archive_terminal_closure_final_integrity_seal_closeout_record_id": {
      "type": "string"
    },
    "closeout_kind": {
      "type": "string"
    },
    "created_time": {
      "type": "string"
    },
    "node_id": {
      "type": "string"
    },
    "retention_permanent_archive_terminal_closure_final_integrity_seal_verification_receipt_id": {
      "type": "string"
    },
    "retention_permanent_archive_terminal_closure_final_integrity_seal_record_id": {
      "type": "string"
    },
    "closeout_state": {
      "type": "string"
    },
    "outcome": {
      "type": "string"
    },
    "closed_refs": {
      "type": "array"
    },
    "subject_refs": {
      "type": "array"
    },
    "basis_refs": {
      "type": "array"
    },
    "closed_by_ref": {
      "type": "string"
    },
    "summary": {
      "type": "string"
    }
  },
  "additionalProperties": true
}
