[
  {
    "retention_permanent_archive_terminal_closure_final_integrity_seal_closeout_record_id": "retention-permanent-archive-terminal-closure-final-integrity-seal-closeout-basic-restore-001",
    "closeout_kind": "retention_permanent_archive_terminal_closure_final_integrity_seal_closeout",
    "created_time": "2026-01-01T00:15:31Z",
    "node_id": "formal-rollup-node-example",
    "retention_permanent_archive_terminal_closure_final_integrity_seal_verification_receipt_id": "retention-permanent-archive-terminal-closure-final-integrity-seal-verification-basic-restore-001",
    "retention_permanent_archive_terminal_closure_final_integrity_seal_record_id": "retention-permanent-archive-terminal-closure-final-integrity-seal-basic-restore-001",
    "closeout_state": "closed",
    "outcome": "retention_permanent_archive_terminal_closure_final_integrity_seal_verified_and_closed",
    "closed_refs": [
      "retention-permanent-archive-terminal-closure-final-integrity-seal-verification-basic-restore-001",
      "retention-permanent-archive-terminal-closure-final-integrity-seal-basic-restore-001",
      "retention/retention-policy.json"
    ],
    "subject_refs": [
      "retention-permanent-archive-terminal-closure-final-summary-basic-restore-001",
      "retention-permanent-archive-terminal-closure-rollup-report-closeout-basic-restore-001",
      "retention-permanent-archive-terminal-authority-release-receipt-closeout-basic-restore-001"
    ],
    "basis_refs": [
      "retention-permanent-archive-terminal-closure-final-integrity-seal-verification-basic-restore-001",
      "retention-permanent-archive-terminal-closure-final-integrity-seal-basic-restore-001",
      "retention/retention-policy.json"
    ],
    "closed_by_ref": "tools/pfem_retention_permanent_archive_terminal_closure_final_integrity_seal_closeout_records.py",
    "summary": "Synthetic example retention permanent archive terminal closure final integrity seal closeout record showing workflow was closed after verification."
  }
]
